{
  "$schema": "http://json-schema.org/draft-07/schema#",
  "$id": "https://aconcaguastonesentinel.com/data/contracts/nodes.schema.json",
  "title": "Route Nodes",
  "description": "Ordered array of route nodes for the Aconcagua Normal Route. Each node encodes terrain semantics consumed by calculateEnvironmentalPressureScore(). Order (routeIndex) defines the canonical POSITIONS array.",
  "type": "array",
  "minItems": 1,
  "items": {
    "type": "object",
    "required": [
      "nodeId",
      "nodeName",
      "altitudeMeters",
      "altitudeBand",
      "terrainLoad",
      "weatherBias",
      "visibilityBias",
      "timeSensitivity",
      "isCamp",
      "stageHint",
      "routeIndex"
    ],
    "additionalProperties": false,
    "properties": {
      "nodeId": {
        "type": "string",
        "description": "Unique snake_case identifier. Normalized to id by normalizeRouteData()."
      },
      "nodeName": {
        "type": "string",
        "description": "Human-readable display name shown in UI route strip and debrief."
      },
      "altitudeMeters": {
        "type": "integer",
        "minimum": 0,
        "description": "Actual altitude in metres. Informational only; engine uses altitudeBand."
      },
      "altitudeBand": {
        "type": "integer",
        "minimum": 0,
        "maximum": 4,
        "description": "Discrete altitude band (0–4) used as key in altitudePressureByBand."
      },
      "terrainLoad": {
        "type": "integer",
        "minimum": 1,
        "maximum": 5,
        "description": "Terrain difficulty (1–5) used as key in terrainLoadScale."
      },
      "weatherBias": {
        "type": "integer",
        "description": "Additive offset to EP from this node's weather exposure."
      },
      "visibilityBias": {
        "type": "integer",
        "description": "Additive offset to EP from this node's visibility exposure."
      },
      "timeSensitivity": {
        "type": "number",
        "minimum": 0,
        "description": "Multiplier applied to the time-of-day risk component."
      },
      "isCamp": {
        "type": "boolean",
        "description": "True when the node is a designated camp where sleep is available."
      },
      "stageHint": {
        "type": "string",
        "enum": ["APPROACH", "HIGH_CAMP", "SUMMIT_DAY"],
        "description": "Stage assignment. Normalized to stage by normalizeRouteData()."
      },
      "routeIndex": {
        "type": "integer",
        "minimum": 0,
        "description": "Zero-based ordinal defining canonical POSITIONS order."
      }
    }
  }
}
