[
  {"nodeId":"horcones","nodeName":"Horcones","altitudeMeters":2950,"altitudeBand":0,"terrainLoad":1,"weatherBias":0,"visibilityBias":0,"timeSensitivity":1,"isCamp":false,"stageHint":"APPROACH","routeIndex":0},
  {"nodeId":"horcones_lagoon","nodeName":"Horcones Lagoon","altitudeMeters":3050,"altitudeBand":0,"terrainLoad":1,"weatherBias":0,"visibilityBias":0,"timeSensitivity":1,"isCamp":false,"stageHint":"APPROACH","routeIndex":1},
  {"nodeId":"approach_confluencia","nodeName":"Approach Camp — Confluencia","altitudeMeters":3390,"altitudeBand":0,"terrainLoad":2,"weatherBias":0,"visibilityBias":0,"timeSensitivity":1,"isCamp":true,"stageHint":"APPROACH","routeIndex":2},
  {"nodeId":"cuesta_brava","nodeName":"Cuesta Brava","altitudeMeters":4000,"altitudeBand":1,"terrainLoad":3,"weatherBias":1,"visibilityBias":1,"timeSensitivity":2,"isCamp":false,"stageHint":"APPROACH","routeIndex":3},
  {"nodeId":"base_plaza_mulas","nodeName":"Base Camp — Plaza de Mulas","altitudeMeters":4350,"altitudeBand":1,"terrainLoad":2,"weatherBias":1,"visibilityBias":1,"timeSensitivity":2,"isCamp":true,"stageHint":"APPROACH","routeIndex":4},
  {"nodeId":"piedras_conway","nodeName":"Piedras Conway","altitudeMeters":4750,"altitudeBand":2,"terrainLoad":3,"weatherBias":1,"visibilityBias":1,"timeSensitivity":2,"isCamp":false,"stageHint":"HIGH_CAMP","routeIndex":5},
  {"nodeId":"camp_canada","nodeName":"Camp 1 — Canadá","altitudeMeters":5050,"altitudeBand":2,"terrainLoad":3,"weatherBias":2,"visibilityBias":1,"timeSensitivity":2,"isCamp":true,"stageHint":"HIGH_CAMP","routeIndex":6},
  {"nodeId":"cambio_pendiente","nodeName":"Cambio de Pendiente (5300m)","altitudeMeters":5300,"altitudeBand":3,"terrainLoad":4,"weatherBias":2,"visibilityBias":2,"timeSensitivity":3,"isCamp":false,"stageHint":"HIGH_CAMP","routeIndex":7},
  {"nodeId":"camp_nido_condores","nodeName":"Camp 2 — Nido de Cóndores","altitudeMeters":5560,"altitudeBand":3,"terrainLoad":4,"weatherBias":2,"visibilityBias":2,"timeSensitivity":3,"isCamp":true,"stageHint":"HIGH_CAMP","routeIndex":8},
  {"nodeId":"balcon_amarillo","nodeName":"El Balcón Amarillo (5800m)","altitudeMeters":5800,"altitudeBand":3,"terrainLoad":4,"weatherBias":3,"visibilityBias":2,"timeSensitivity":3,"isCamp":false,"stageHint":"HIGH_CAMP","routeIndex":9},
  {"nodeId":"camp_colera","nodeName":"Camp 3 — Cólera","altitudeMeters":5970,"altitudeBand":3,"terrainLoad":4,"weatherBias":3,"visibilityBias":2,"timeSensitivity":3,"isCamp":true,"stageHint":"SUMMIT_DAY","routeIndex":10},
  {"nodeId":"portezuelo_viento","nodeName":"Portezuelo del Viento","altitudeMeters":6500,"altitudeBand":4,"terrainLoad":5,"weatherBias":4,"visibilityBias":3,"timeSensitivity":4,"isCamp":false,"stageHint":"SUMMIT_DAY","routeIndex":11},
  {"nodeId":"travesia","nodeName":"La Travesía","altitudeMeters":6630,"altitudeBand":4,"terrainLoad":5,"weatherBias":4,"visibilityBias":4,"timeSensitivity":4,"isCamp":false,"stageHint":"SUMMIT_DAY","routeIndex":12},
  {"nodeId":"canaleta","nodeName":"La Canaleta","altitudeMeters":6700,"altitudeBand":4,"terrainLoad":5,"weatherBias":4,"visibilityBias":4,"timeSensitivity":4,"isCamp":false,"stageHint":"SUMMIT_DAY","routeIndex":13},
  {"nodeId":"summit","nodeName":"Summit","altitudeMeters":6962,"altitudeBand":4,"terrainLoad":5,"weatherBias":4,"visibilityBias":4,"timeSensitivity":4,"isCamp":false,"stageHint":"SUMMIT_DAY","routeIndex":14}
]
